Year|Month|Day|Time|End Year|End Month|End Day|End Time|Display Date|Headline|Text|Media|Media Credit|Media Caption|Media Thumbnail|Alt Text|Type|Group|Background
1931 | 9 | 7 | | 1931 | 12 | 1 | | September 7-December 1, 1931 | Second Round Table Conference | <h3>Event Summary</h3><p>The Second Round Table Conference was held with Gandhi as the sole Congress representative, but ended in deadlock over minority representation.</p><h4>Key Details</h4><ul><li>Gandhi claimed to represent all Indians</li><li>Disagreements arose over minority representation</li><li>Session deadlocked on the Minorities' Pact</li><li>Gandhi demanded partnership based on equality</li><li>Women participants included Sarojini Naidu, Begum Jahanara Shahnawaz, and Radhabai Subbarayan</li></ul><h4>Significance</h4><p>No substantial results were achieved due to disagreements, but MacDonald announced two Muslim majority provinces (NWFP, Sindh).</p> | | | | | | | Constitutional Development |
1931 | 9 | | | | | | | September 1931 | Hijli Jail Firing Incident | <h3>Event Summary</h3><p>The Hijli Jail firing incident occurred during the truce period of the Civil Disobedience Movement.</p><h4>Key Details</h4><ul><li>The incident took place in September 1931</li><li>It was one of several instances of government repression during the truce period</li></ul> | | | | | | | British |
1931 | 12 | 31 | | | | | | December 31, 1931 | Viceroy Willingdon Refuses Meeting with Gandhi | <h3>Event Summary</h3><p>Viceroy Willingdon refused to meet with Gandhi, signaling a change in government attitude after the Second Round Table Conference.</p><h4>Key Details</h4><ul><li>The refusal came on December 31, 1931</li><li>It marked a shift in government approach to prevent Gandhi from building mass movement momentum</li><li>This was part of a strategy to maintain confidence of government functionaries and loyalists</li><li>The government aimed to block rural consolidation of the national movement</li></ul> | | | | | | | British |
1932 | 1 | 4 | | | | | | January 4, 1932 | Gandhi's Arrest | <h3>Event Summary</h3><p>Gandhi was arrested as part of the government's crackdown on the resumed Civil Disobedience Movement.</p><h4>Key Details</h4><ul><li>The arrest came shortly after Viceroy Willingdon refused to meet with Gandhi</li><li>It was part of the government's "Civil Martial Law" imposed via repressive ordinances</li><li>The arrest was followed by banning of Congress, arrests of activists, and confiscation of properties</li></ul> | | | | | | | British |
1932 | 8 | 16 | | | | | | August 16, 1932 | Communal Award Announced | <h3>Event Summary</h3><p>Ramsay MacDonald announced the Communal Award based on findings of the Lothian Committee, establishing separate electorates for various communities.</p><h4>Key Details</h4><ul><li>Established separate electorates for Muslims, Europeans, Sikhs, Indian Christians, Anglo-Indians, depressed classes, and Marathas lasting 20 years</li><li>Provincial legislature seats were distributed on communal basis</li><li>Existing provincial legislature seats were doubled</li><li>Muslims in minority areas were granted weightage</li><li>Depressed classes were accorded minority status and given "double vote" (separate and general electorates)</li><li>3% seats were reserved for women in all provinces except NWFP</li><li>Specific seat allocations were made for labourers, landlords, traders, industrialists</li></ul> | | | | | | | Constitutional Development |
1932 | 9 | 20 | | | | | | September 20, 1932 | Gandhi's Fast Against Separate Electorates | <h3>Event Summary</h3><p>Gandhi began an indefinite fast to protest separate electorates for depressed classes as outlined in the Communal Award.</p><h4>Key Details</h4><ul><li>Gandhi viewed the Award as an attack on Indian unity and nationalism</li><li>He argued separate political entity for depressed classes would undermine abolishing untouchability</li><li>Gandhi claimed separate electorates would perpetuate untouchability</li><li>He demanded depressed classes be elected through joint electorates</li></ul> | | | | | | | Freedom Movement |
1932 | 9 | 24 | | | | | | September 24, 1932 | Poona Pact | <h3>Event Summary</h3><p>B.R. Ambedkar signed an agreement with Gandhi abandoning separate electorates for depressed classes in favor of reserved seats in joint electorates.</p><h4>Key Details</h4><ul><li>Reserved seats for depressed classes were increased from 71 to 147 in provincial legislatures</li><li>18% seats were reserved in the Central Legislature</li><li>The government accepted this amendment to the Communal Award</li><li>The agreement was negotiated by Ambedkar, MC Rajah, and Madan Mohan Malaviya</li></ul><h4>Significance</h4><p>The pact had long-term consequences for Dalit representation, subordinating them into the Hindu social structure and blocking equality-based society.</p> | | | | | | | Constitutional Development |
1932 | 9 | | | | | | | September 1932 | Establishment of All India Anti-Untouchability League | <h3>Event Summary</h3><p>Gandhi established the All India Anti-Untouchability League to campaign against untouchability.</p><h4>Key Details</h4><ul><li>The organization was founded in September 1932</li><li>It was part of Gandhi's broader Harijan campaign</li></ul> | | | | | | | Socio-Religious Reforms |
1932 | 11 | 17 | | 1932 | 12 | 24 | | November 17-December 24, 1932 | Third Round Table Conference | <h3>Event Summary</h3><p>The Third Round Table Conference was held without Congress participation, with little achieved.</p><h4>Key Details</h4><ul><li>Participants included princely states representatives, Aga Khan III, B.R. Ambedkar, M.R. Jayakar, and Tej Bahadur Sapru</li><li>Begum Jahanara Shahnawaz was a woman participant</li><li>The conference was boycotted by the Indian National Congress and Gandhi</li><li>Like previous conferences, little was achieved</li></ul><h4>Significance</h4><p>Recommendations were published in a White Paper in March 1933, debated in British Parliament, and eventually led to the Government of India Act of 1935.</p> | | | | | | | Constitutional Development |
1933 | 1 | | | | | | | January 1933 | Launch of Harijan Newspaper | <h3>Event Summary</h3><p>Gandhi started the weekly Harijan newspaper as part of his campaign against untouchability.</p><h4>Key Details</h4><ul><li>The newspaper was launched in January 1933</li><li>It was a key component of Gandhi's Harijan campaign</li></ul> | | | | | | | Socio-Religious Reforms |
1933 | 8 | | | | | | | August 1933 | Gandhi's Campaign Against Untouchability | <h3>Event Summary</h3><p>Gandhi launched a campaign against untouchability while still in jail.</p><h4>Key Details</h4><ul><li>The campaign began in August 1933</li><li>Gandhi initiated it while still imprisoned</li></ul> | | | | | | | Socio-Religious Reforms |
1933 | 11 | | | 1934 | 7 | | | November 1933-July 1934 | Gandhi's Harijan Tour | <h3>Event Summary</h3><p>After his release, Gandhi conducted a nationwide Harijan tour covering 20,000 km to collect funds for the Harijan Sevak Sangh.</p><h4>Key Details</h4><ul><li>The tour covered 20,000 kilometers across India</li><li>Gandhi collected funds for the Harijan Sevak Sangh</li><li>He faced opposition from orthodox Hindus</li><li>Gandhi combined social reform with nationalist messaging to Harijan laborers</li></ul> | | | | | | | Socio-Religious Reforms |
1934 | | | | | | | | 1934 | Defeat of Temple Entry Bill | <h3>Event Summary</h3><p>The government defeated the Temple Entry Bill which would have allowed Dalits entry into temples.</p><h4>Key Details</h4><ul><li>The bill would have legally permitted Dalits to enter Hindu temples</li><li>Its defeat was a setback to Gandhi's Harijan campaign</li></ul> | | | | | | | Socio-Religious Reforms |
1934 | | | | | | | | 1934 | Gandhi Withdraws Civil Disobedience Movement | <h3>Event Summary</h3><p>Gandhi withdrew the Civil Disobedience Movement despite maintaining political faith in its principles.</p><h4>Key Details</h4><ul><li>The movement had failed as leaders were arrested and masses were unprepared</li><li>Gandhi maintained his political faith in civil disobedience despite withdrawing the movement</li></ul><h4>Significance</h4><p>This marked the end of the second major nationwide movement led by Gandhi after the Non-Cooperation Movement.</p> | | | | | | | Freedom Movement |
1935 | 7 | | | | | | | July 1935 | Government of India Act Enforced | <h3>Event Summary</h3><p>The Government of India Act of 1935 was enforced, following recommendations from the Round Table Conferences.</p><h4>Key Details</h4><ul><li>The Act resulted from recommendations published in the White Paper (March 1933)</li><li>It was debated in British Parliament</li><li>A Joint Select Committee was formed to review it</li><li>The Draft Bill was produced in February 1935</li></ul> | | | | | | | Constitutional Development |
1934 | | | | 1935 | | | | 1934-1935 | First Stage Debate on Future Strategy | <h3>Event Summary</h3><p>The first stage of the debate on future strategy after the Civil Disobedience Movement took place between 1934 and 1935, focusing on immediate strategy.</p><h4>Key Details</h4><ul><li>Three perspectives emerged: Gandhian constructive work, constitutional participation, and leftist mass struggle</li><li>Nehru led the leftist perspective, advocating continuous confrontation through direct action</li><li>Nehru rejected the Struggle-Truce-Struggle strategy in favor of a Struggle-Victory approach</li><li>Gandhi reconciled opposition by ensuring constructive work continued alongside parliamentary politics</li></ul><h4>Significance</h4><p>This debate shaped the direction of the nationalist movement following the Civil Disobedience Movement.</p> | | | | | | | Freedom Movement |
1934 | | | | | | | | | Congress Establishes Parliamentary Board | <h3>Event Summary</h3><p>In 1934, the Congress established a Parliamentary Board and won 44 out of 75 Indian seats.</p><h4>Key Details</h4><ul><li>This marked Congress's formal entry into parliamentary politics</li><li>The decision came after reconciliation of opposing views within the movement</li><li>Congress won a significant majority of available seats</li></ul><h4>Significance</h4><p>This represented a strategic shift in the Congress approach, incorporating parliamentary politics alongside other forms of resistance.</p> | | | | | | | Constitutional Development |
1934 | | | | | | | | | Gandhi Announces Resignation from Congress | <h3>Event Summary</h3><p>In 1934, Gandhi announced his resignation from the Congress.</p><h4>Key Details</h4><ul><li>Internal tensions remained between Gandhi and various sections of Congress</li><li>Some sections favored parliamentary politics</li><li>Others opposed Gandhi's emphasis on the spinning wheel as "the second lung of the nation"</li><li>A section of socialists led by Nehru had ideological differences with Gandhi</li></ul><h4>Significance</h4><p>Gandhi's resignation highlighted the internal divisions within the Congress movement at this critical juncture.</p> | | | | | | | Nationalist Leaders |
1935 | | | | | | | | | Government of India Act 1935 | <h3>Event Summary</h3><p>The Government of India Act 1935 was enacted, introducing significant constitutional changes to British India.</p><h4>Key Details</h4><ul><li>The Act included provisions for administration, central legislature, and provincial legislature</li><li>It had limitations including governor general's safeguards and special responsibilities</li><li>Limited franchise to only 14% of the population</li><li>Included communal electorates that fostered separatism</li><li>The constitution was rigid with amendment rights reserved for British Parliament</li></ul><h4>Significance</h4><p>The Act was part of a long-term British strategy to weaken the national movement by integrating segments into the colonial administrative structure and creating dissensions within Congress.</p> | | | | | | | Constitutional Development |
1935 | | | | | | | | | Congress Rejects 1935 Act | <h3>Event Summary</h3><p>The Congress formally rejected the Government of India Act 1935, while it was supported by Hindu Mahasabha and National Liberal Foundation.</p><h4>Key Details</h4><ul><li>Congress demanded an adult franchise-based Constituent Assembly instead</li><li>The rejection highlighted Congress's opposition to the colonial constitutional framework</li><li>Other political organizations like Hindu Mahasabha took a different stance by supporting the Act</li></ul><h4>Significance</h4><p>This rejection demonstrated Congress's continued commitment to complete independence rather than accepting partial reforms.</p> | | | | | | | Constitutional Development |
1936 | | | | | | | | | Gandhi Changes Position on Office Acceptance | <h3>Event Summary</h3><p>By 1936, Gandhi changed his position and became willing to give trial to Congress ministries.</p><h4>Key Details</h4><ul><li>Gandhi had initially opposed office acceptance at the CWC meeting</li><li>His change in position influenced the Congress's approach to the upcoming elections</li><li>This shift represented a pragmatic approach to using the available political mechanisms</li></ul><h4>Significance</h4><p>Gandhi's change in position was crucial in shaping Congress's strategy regarding participation in provincial governments.</p> | | | | | | | Nationalist Leaders |
1936 | | | | | | | | | Lucknow Session of Congress | <h3>Event Summary</h3><p>The Congress session at Lucknow in 1936 decided to fight the upcoming elections.</p><h4>Key Details</h4><ul><li>This decision came after extensive debate on the approach to the 1935 Act</li><li>The session formalized Congress's electoral strategy</li><li>It represented a compromise between different factions within Congress</li></ul><h4>Significance</h4><p>The Lucknow session marked a significant strategic decision to engage with the electoral process while maintaining opposition to the 1935 Act.</p> | | | | | | | Freedom Movement |
1937 | | | | | | | | | Faizpur Session of Congress | <h3>Event Summary</h3><p>The Congress session at Faizpur in 1937 reaffirmed the decision to fight elections.</p><h4>Key Details</h4><ul><li>This session continued the electoral strategy decided at Lucknow</li><li>Congress resolved not to submit to the constitution but to combat it inside and outside legislatures</li><li>The session helped finalize Congress's approach to the upcoming elections</li></ul><h4>Significance</h4><p>The Faizpur session solidified Congress's dual strategy of participating in elections while continuing to oppose the constitutional framework.</p> | | | | | | | Freedom Movement |
1937 | 2 | | | | | | | February 1937 | Provincial Elections | <h3>Event Summary</h3><p>In February 1937, provincial elections were held with 30.1 million voters participating.</p><h4>Key Details</h4><ul><li>Congress won 716 out of 1,161 seats</li><li>Congress secured a majority in most provinces</li><li>The results vindicated the nationalist strategy</li><li>Congress's prestige increased as a result of the electoral victory</li></ul><h4>Significance</h4><p>The election results demonstrated widespread popular support for Congress and validated their decision to participate in the electoral process.</p> | | | | | | | Constitutional Development |
1937 | | | | | | | | 1937 | Second Stage Debate on Future Strategy | <h3>Event Summary</h3><p>In 1937, the second stage of the debate on future strategy took place, focusing on the question of office acceptance in provincial elections under the Government of India Act 1935.</p><h4>Key Details</h4><ul><li>The debate resumed as provincial elections were announced</li><li>Ideological divisions emerged on the post-election approach</li><li>Nehru, Bose, and leftists opposed office acceptance</li><li>Others favored participation as a strategy to combat the Act from within</li><li>The debate centered on whether accepting office would negate rejection of the Act</li></ul><h4>Significance</h4><p>This debate shaped Congress's approach to governing in provinces where they won elections and influenced the broader nationalist strategy.</p> | | | | | | | Freedom Movement |
1937 |  |  |  | 1939 |  |  |  | 1937-1939 | Congress Ministries in Provinces | <h3>Event Summary</h3><p>Congress ministries were formed in Bombay, Madras, Central Provinces, Orissa, UP, Bihar, NWFP, and Assam. These ministries functioned until 1939 when they resigned after the outbreak of WWII.</p><h4>Key Details</h4><ul><li>Gandhi advised Congress ministers to hold offices lightly and see them as a "crown of thorns"</li><li>Congress aimed to prove it could rule with minimal police/army</li><li>Ministries increased Congress prestige but couldn't change imperial system fundamentals</li><li>Power struggles emerged by 1939</li></ul><h4>Significance</h4><p>Congress rule confirmed the necessity of self-government, demonstrated use of state power, controlled riots, weakened bureaucracy, neutralized opposition, and provided a preview of independence. Administrative success disproved the "Indians-can't-rule myth".</p> |  |  |  |  |  |  | Constitutional Development |
1937 |  |  |  | 1939 |  |  |  | 1937-1939 | Post-Emergency Civil Liberties Reforms | <h3>Event Summary</h3><p>Congress ministries implemented various civil liberties reforms after taking office in the provinces.</p><h4>Key Details</h4><ul><li>Repealed emergency powers laws</li><li>Lifted ban on organizations like Hindustan Seva Dal and Youth Leagues</li><li>Removed press restrictions and newspapers from blacklists</li><li>Restored confiscated arms/licenses and curbed police powers</li><li>Stopped shadowing politicians</li><li>Released political prisoners and revoked deportation/internment orders</li><li>Restored lands confiscated during Civil Disobedience Movement</li><li>Restored pensions of officials associated with Civil Disobedience Movement</li></ul> |  |  |  |  |  |  | Freedom Movement |
1937 |  |  |  | 1939 |  |  |  | 1937-1939 | Agrarian Reforms Under Congress Ministries | <h3>Event Summary</h3><p>Congress ministries implemented agrarian reforms despite various constraints.</p><h4>Key Details</h4><ul><li>Reforms were constrained by inadequate ministerial powers, confrontational politics, reactionary Legislative Council, insufficient financial powers, complex agrarian structure, and need to neutralize zamindars</li><li>Despite constraints, Congress legislated laws on land reforms, debt relief, grazing fees, and rent arrears</li><li>Main beneficiaries were statutory and occupancy tenants</li></ul> |  |  |  |  |  |  | Economic Policies |
1937 |  |  |  | 1939 |  |  |  | 1937-1939 | Labour Reforms Under Congress Rule | <h3>Event Summary</h3><p>Congress ministries implemented labour reforms while balancing between worker interests and controlling militant unions.</p><h4>Key Details</h4><ul><li>Promoted arbitration over strikes</li><li>Improved working conditions</li><li>Controlled militant unions</li><li>By 1938, shifted toward capitalists and away from labor</li></ul> |  |  |  |  |  |  | Economic Policies |
1937 |  |  |  | 1939 |  |  |  | 1937-1939 | Social Welfare Initiatives Under Congress | <h3>Event Summary</h3><p>Congress ministries implemented various social welfare initiatives focusing on Harijan welfare, education, public health, and economic development.</p><h4>Key Details</h4><ul><li>Implemented Harijan welfare measures including temple entry, public facilities access, and scholarships</li><li>Increased Harijan representation in government services and police</li><li>Focused on primary/technical/higher education</li><li>Improved public health and sanitation</li><li>Promoted khadi through subsidies</li><li>Encouraged indigenous enterprises</li><li>Implemented prison reforms</li></ul> |  |  |  |  |  |  | Socio-Religious Reforms |
1938 |  |  |  |  |  |  |  |  | Formation of National Planning Committee | <h3>Event Summary</h3><p>The National Planning Committee was established under Subhas Chandra Bose to plan economic development.</p><h4>Key Details</h4><ul><li>Formed in 1938</li><li>Led by Subhas Chandra Bose</li><li>Aimed at planning national development</li></ul> |  |  |  |  |  |  | Economic Policies |
1938 |  |  |  |  |  |  |  |  | Bombay Traders Disputes Act | <h3>Event Summary</h3><p>Congress passed the anti-labor Bombay Traders Disputes Act in 1938.</p><h4>Key Details</h4><ul><li>Considered anti-labor legislation</li><li>Reflected Congress's shift toward capitalists and away from labor interests</li></ul> |  |  |  |  |  |  | Economic Policies |
1938 |  |  |  |  |  |  |  |  | Pirpur Committee Report | <h3>Event Summary</h3><p>The All India Muslim League established the Pirpur Committee which documented alleged Congress atrocities against Muslims.</p><h4>Key Details</h4><ul><li>Formed in 1938</li><li>Charged Congress with religious interference</li><li>Claimed Urdu suppression</li><li>Alleged Hindu favoritism</li><li>Claimed Muslim marginalization in representation and economy</li></ul><h4>Significance</h4><p>This report reflected growing tensions between the Muslim League and Congress, with the League being annoyed with Congress for not sharing power.</p> |  |  |  |  |  |  | Freedom Movement |
1939 |  |  |  |  |  |  |  |  | Resignation of Congress Ministries | <h3>Event Summary</h3><p>Congress ministries resigned after the outbreak of World War II in 1939.</p><h4>Key Details</h4><ul><li>Resignation followed power struggles within Congress</li><li>Directly connected to the outbreak of World War II</li></ul> |  |  |  |  |  |  | Freedom Movement |
1938 | | | | | | | | | Subhash Bose Elected President at Haripura | <h3>Event Summary</h3><p>Subhash Chandra Bose was elected president of the Indian National Congress at the Haripura session.</p><h4>Key Details</h4><ul><li>Bose advocated economic development through planning</li><li>He set up a National Planning Committee later</li><li>He supported agitation against princely states</li></ul><h4>Significance</h4><p>This marked Bose's rise to a position of national leadership within the Congress.</p> | | | | | | | Nationalist Leaders
1939 | | | | | | | | | Bose Re-elected Congress President Against Gandhi's Candidate | <h3>Event Summary</h3><p>Subhash Chandra Bose won the Congress presidency again, defeating Gandhi's preferred candidate.</p><h4>Key Details</h4><ul><li>Gandhi stated "Pattabhi's defeat is my defeat"</li><li>Ideological polarization intensified within Congress</li><li>The Working Committee resigned after Bose accused them of being ready to compromise with the government on federation matters</li></ul><h4>Significance</h4><p>This election highlighted the growing ideological divide within the Congress leadership.</p> | | | | | | | Nationalist Leaders
1939 | 3 | | | | | | | March 1939 | Bose Calls for Six-Month Ultimatum to British at Tripuri | <h3>Event Summary</h3><p>At the Tripuri session, Subhash Chandra Bose called for a six-month ultimatum to be given to the British.</p><h4>Key Details</h4><ul><li>Bose argued that Congress was strong, masses were ready, and the international crisis (WWII) was favorable</li><li>Gandhi opposed the ultimatum, citing unreadiness, communal discord, and class strife</li><li>A resolution was passed supporting the Gandhian approach</li></ul><h4>Significance</h4><p>This confrontation represented a fundamental ideological divide between immediate radical action (Bose) versus preparation (Gandhi).</p> | | | | | | | Freedom Movement
1939 | 4 | | | | | | | April 1939 | Bose Resigns as Congress President | <h3>Event Summary</h3><p>Subhash Chandra Bose resigned from the presidency of the Indian National Congress.</p><h4>Key Details</h4><ul><li>Rajendra Prasad was elected as the new president</li><li>This followed the Tripuri confrontation where Gandhi's approach was endorsed over Bose's</li></ul> | | | | | | | Nationalist Leaders
1939 | 5 | | | | | | | May 1939 | Bose Forms Forward Bloc within Congress | <h3>Event Summary</h3><p>Subhash Chandra Bose formed the Forward Bloc as a faction within the Indian National Congress.</p><h4>Key Details</h4><ul><li>This followed his resignation as Congress president in April</li><li>The Forward Bloc represented Bose's more radical approach to the independence struggle</li></ul> | | | | | | | Freedom Movement
1939 | 8 | | | | | | | August 1939 | Bose Removed from Bengal Provincial Congress Committee Leadership | <h3>Event Summary</h3><p>Subhash Chandra Bose was removed from leadership of the Bengal Provincial Congress Committee.</p><h4>Key Details</h4><ul><li>He was also barred from holding office</li><li>This action followed his formation of the Forward Bloc within Congress</li></ul> | | | | | | | Nationalist Leaders
1939 | 9 | 1 | | | | | | September 1, 1939 | Germany Attacks Poland, Starting World War II | <h3>Event Summary</h3><p>Germany attacked Poland on September 1, 1939, marking the beginning of World War II.</p><h4>Key Details</h4><ul><li>Britain declared war on Germany on September 3</li><li>British India declared support for the war without Indian consultation</li></ul> | | | | | | | British
1939 | 10 | 23 | | | | | | October 23, 1939 | Congress Working Committee Rejects Viceregal Statement | <h3>Event Summary</h3><p>The Congress Working Committee rejected the Viceroy's statement as imperialist policy.</p><h4>Key Details</h4><ul><li>The CWC decided not to support the war effort</li><li>Called for Congress ministries to resign in provinces</li></ul> | | | | | | | Freedom Movement
1939 | 11 | | | | | | | November 1939 | CWC Resolution Declares War Fought for Imperialist Ends | <h3>Event Summary</h3><p>The Congress Working Committee passed a resolution declaring that World War II was being fought for imperialist ends like World War I.</p><h4>Key Details</h4><ul><li>The resolution demanded independence for India</li><li>It also called for a constituent assembly</li></ul> | | | | | | | Freedom Movement
