Year|Month|Day|Time|End Year|End Month|End Day|End Time|Display Date|Headline|Text|Media|Media Credit|Media Caption|Media Thumbnail|Alt Text|Type|Group|Background
1764 | | | | | | | | | Battle of Buxar | <h3>Event Summary</h3><p>English forces defeated the combined armies of Mir Kasim, the Nawab of Awadh (Shuja-ud-Daulah), and the Mughal Emperor Shah Alam II at Buxar.</p><h4>Key Details</h4><ul><li>The battle occurred after Mir Kasim fled to Awadh and formed an alliance against the British</li><li>The conflict arose from tensions over trade practices and duty exemptions</li><li>This was the first time the Mughal Emperor himself was defeated by the English</li></ul><h4>Significance</h4><p>The victory established the English as a major power in northern India and laid the groundwork for the Treaty of Allahabad.</p> | | | | | | | Wars |
1765 | | | | | | | | | Treaty of Allahabad | <h3>Event Summary</h3><p>Robert Clive concluded treaties with the Nawab of Awadh and the Mughal Emperor following the English victory at Buxar.</p><h4>Key Details</h4><ul><li>Nawab Shuja-ud-Daula surrendered Allahabad and Kara to Shah Alam II</li><li>The Nawab agreed to pay ₹50 lakh war indemnity</li><li>Shah Alam II issued a farman granting diwani of Bengal, Bihar, and Orissa to the Company</li><li>Clive avoided annexing Awadh to create a buffer state</li></ul><h4>Significance</h4><p>The Emperor's farman legalized the Company's political gains in Bengal and established the foundation for the Dual Government system.</p> | | | | | | | Treaties |
1765 | | | | 1772 | | | | 1765-1772 | Dual Government in Bengal | <h3>Event Summary</h3><p>The East India Company established a dual system of governance in Bengal where they controlled revenue collection (diwani) while the Nawab controlled police functions (nizamat).</p><h4>Key Details</h4><ul><li>The Company became the real masters of Bengal while maintaining the facade of the Nawab's rule</li><li>The Company exercised diwani rights as the diwan</li><li>The system advantaged the Company by allowing them to hold real power while maintaining a puppet ruler</li><li>The system eventually led to administrative breakdown</li></ul><h4>Significance</h4><p>This arrangement allowed the British to exercise real power while avoiding direct responsibility for administration until Warren Hastings abolished the system in 1772.</p> | | | | | | | British |
1772 | | | | | | | | | Abolition of Dual Government System | <h3>Event Summary</h3><p>Warren Hastings abolished the dual system of government in Bengal that had been in place since 1765.</p><h4>Key Details</h4><ul><li>The dual system had led to administrative breakdown</li><li>The system had allowed the Company to control revenue while the Nawab controlled police functions</li><li>Hastings' reform marked a shift toward more direct British administration</li></ul><h4>Significance</h4><p>This change represented a significant step toward direct British governance in India rather than ruling through puppet authorities.</p> | | | | | | | British |
1767 | | | | 1769 | | | | 1767-1769 | First Anglo-Mysore War | <h3>Event Summary</h3><p>The first military conflict between the British East India Company and the Kingdom of Mysore under Haidar Ali.</p><h4>Key Details</h4><ul><li>The war began after British confidence from Bengal success led to a treaty with the Nizam in 1766</li><li>An initial alliance of British, Nizam, and Marathas against Haidar collapsed when Haidar diplomatically turned the Marathas neutral and the Nizam into an ally</li><li>The war continued inconclusively for 18 months until Haidar's strategic move to Madras gates created panic</li><li>Ended with the Treaty of Madras in April 1769</li></ul><h4>Significance</h4><p>The Treaty of Madras was humiliating for the British and established mutual territory restitution and a defensive alliance.</p> | | | | | | | Wars |
1769 | 4 | | | | | | | April 1769 | Treaty of Madras | <h3>Event Summary</h3><p>The Treaty of Madras ended the First Anglo-Mysore War between the British East India Company and Haidar Ali of Mysore.</p><h4>Key Details</h4><ul><li>The treaty was signed in April 1769</li><li>It established mutual territory restitution between the British and Mysore</li><li>The treaty included a defensive alliance between the parties</li></ul><h4>Significance</h4><p>The treaty was considered humiliating for the British, as Haidar Ali had forced them to negotiate after his strategic move to the gates of Madras created panic.</p> | | | | | | | Treaties |
1780 | | | | 1784 | | | | 1780-1784 | Second Anglo-Mysore War | <h3>Event Summary</h3><p>The second military conflict between the British East India Company and the Kingdom of Mysore, initially under Haidar Ali and later under Tipu Sultan.</p><h4>Key Details</h4><ul><li>The war began after British violated the Treaty of Madras by not supporting Haidar when attacked by Marathas in 1771</li><li>Haidar formed a coalition with Marathas and Nizam, defeating British under Colonel Baillie in 1781</li><li>Haidar died in December 1782, and his son Tipu Sultan continued the war</li><li>The war ended with the Treaty of Mangalore in March 1784</li></ul><h4>Significance</h4><p>The Treaty of Mangalore returned both sides to pre-war territorial status quo, representing a stalemate rather than a decisive victory for either side.</p> | | | | | | | Wars |
1781 | | | | | | | | | Battle of Porto Novo | <h3>Event Summary</h3><p>The English forces defeated Haidar Ali at Porto Novo (modern day Parangipettai, a coastal town in Tamil Nadu).</p><h4>Key Details</h4><ul><li>The English had regrouped after earlier defeats</li><li>They had successfully detached the Marathas and Nizam from Haidar's alliance</li><li>This battle represented a turning point in the Second Anglo-Mysore War</li></ul><h4>Significance</h4><p>This victory helped the British recover from earlier setbacks in the Second Anglo-Mysore War and strengthened their position.</p> | | | | | | | Wars |
1784 | 3 | | | | | | | March 1784 | Treaty of Mangalore | <h3>Event Summary</h3><p>The Treaty of Mangalore ended the Second Anglo-Mysore War between the British East India Company and Mysore under Tipu Sultan.</p><h4>Key Details</h4><ul><li>The treaty was signed in March 1784</li><li>Both sides agreed to return to pre-war territorial status quo</li><li>The treaty came after Tipu Sultan continued the war for about a year following his father Haidar Ali's death in December 1782</li></ul><h4>Significance</h4><p>The treaty represented a stalemate rather than a decisive victory for either side, allowing both powers to regroup before future conflicts.</p> | | | | | | | Treaties |
1790 | | | | 1792 | | | | 1790-1792 | Third Anglo-Mysore War | <h3>Event Summary</h3><p>The third military conflict between the British East India Company and the Kingdom of Mysore under Tipu Sultan.</p><h4>Key Details</h4><ul><li>Tipu declared war in April 1790 against Travancore, a British ally, over a territorial rights dispute</li><li>Lord Cornwallis personally took command in 1791, captured Bangalore and advanced toward Seringapatam</li><li>British forces, supported by Marathas and Nizam, twice threatened Seringapatam</li><li>The war ended with the Treaty of Seringapatam in 1792</li></ul><h4>Significance</h4><p>The Treaty of Seringapatam forced Tipu to surrender half his territories and pay a substantial indemnity of ₹3 crore, significantly weakening Mysore's power.</p> | | | | | | | Wars |
1792 | | | | | | | | | Treaty of Seringapatam | <h3>Event Summary</h3><p>The Treaty of Seringapatam ended the Third Anglo-Mysore War between the British East India Company and Tipu Sultan of Mysore.</p><h4>Key Details</h4><ul><li>Tipu was forced to surrender half his territories</li><li>He had to pay a substantial indemnity of ₹3 crore</li><li>Tipu's sons were taken as hostages until the initial payment was made</li><li>The remaining amount was to be paid in installments</li></ul><h4>Significance</h4><p>This treaty significantly weakened Mysore's power and expanded British territorial control in southern India.</p> | | | | | | | Treaties |
1799 | 4 | 17 | | 1799 | 5 | 4 | | April 17 - May 4, 1799 | Fourth Anglo-Mysore War | <h3>Event Summary</h3><p>The final military conflict between the British East India Company and the Kingdom of Mysore under Tipu Sultan.</p><h4>Key Details</h4><ul><li>The war lasted from April 17 to May 4, 1799</li><li>Lord Wellesley, who became governor-general in 1798, grew concerned about Tipu's French connections</li><li>The British accused Tipu of plotting with regional powers and sending emissaries to foreign nations</li><li>The war ended with the fall of Seringapatam and Tipu's death in battle</li></ul><h4>Significance</h4><p>Mysore was dismembered after the war, with territories distributed among the British, Marathas, and Nizam. The Wodeyar dynasty was restored under British subsidiary alliance system.</p> | | | | | | | Wars |
1775 | | | | 1782 | | | | 1775-1782 | First Anglo-Maratha War | <h3>Event Summary</h3><p>The first military conflict between the British East India Company and the Maratha Empire.</p><h4>Key Details</h4><ul><li>The war began due to British intervention in Maratha succession disputes</li><li>In 1775, Raghunathrao sought English help and signed the Treaty of Surat</li><li>The Treaty of Purandhar in 1776 annulled the Surat treaty and denounced Raghunathrao</li><li>In 1779, surrounded English forces surrendered and signed the Treaty of Wadgaon</li><li>The war ended with the Treaty of Salbai in 1782</li></ul><h4>Significance</h4><p>The war demonstrated the military capabilities of both sides and established a period of relative peace between the British and Marathas for about two decades.</p> | | | | | | | Wars |
1775 | | | | | | | | | Treaty of Surat | <h3>Event Summary</h3><p>Raghunathrao signed the Treaty of Surat with the English to gain support in his claim to the Peshwaship.</p><h4>Key Details</h4><ul><li>The treaty ceded territories of Salsette and Bassein to the English with a portion of revenue</li><li>The English promised 2,500 soldiers to support Raghunathrao</li><li>The British Calcutta Council later condemned this treaty</li><li>Colonel Upton was sent to Pune to negotiate a new agreement</li></ul><h4>Significance</h4><p>This treaty represented the beginning of British intervention in Maratha succession politics, though it was later annulled.</p> | | | | | | | Treaties |
1776 | | | | | | | | | Treaty of Purandhar | <h3>Event Summary</h3><p>The Treaty of Purandhar annulled the earlier Treaty of Surat and denounced Raghunathrao's claim to power.</p><h4>Key Details</h4><ul><li>The treaty was negotiated by Colonel Upton, sent by the British Calcutta Council</li><li>It effectively reversed the British support for Raghunathrao established in the Treaty of Surat</li><li>This treaty was later violated by Nana Phadnavis in 1777 when he granted a port to the French</li></ul><h4>Significance</h4><p>This treaty represented a temporary setback for British influence in Maratha affairs and demonstrated the complex diplomatic maneuvering during this period.</p> | | | | | | | Treaties |
1779 | | | | | | | | | Treaty of Wadgaon | <h3>Event Summary</h3><p>Surrounded English forces surrendered to Mahadji Scindia and signed the Treaty of Wadgaon.</p><h4>Key Details</h4><ul><li>Mahadji Scindia had trapped English forces in mountain passes near Talegaon</li><li>Scorched earth tactics cut English food and water supplies</li><li>The treaty reversed all English territorial gains since 1775</li><li>Warren Hastings later rejected this treaty</li></ul><h4>Significance</h4><p>This treaty represented a significant Maratha victory, though it was short-lived as Warren Hastings refused to recognize it and continued military operations.</p> | | | | | | | Treaties |
1782 | | | | | | | | | Treaty of Salbai | <h3>Event Summary</h3><p>The Treaty of Salbai ended the First Anglo-Maratha War between the British East India Company and the Maratha Empire.</p><h4>Key Details</h4><ul><li>The treaty was signed after the English under General Camac defeated Scindia at Sipri in February 1781</li><li>Key provisions included: Salsette remaining with the English, territories conquered since the Treaty of Purandhar returned to Marathas, Fateh Singh Gaekwad maintaining pre-war territory</li><li>The English agreed not to support Raghunathrao</li><li>Haidar Ali was to return territory taken from the English</li><li>The Peshwa agreed not to support other European nations</li></ul><h4>Significance</h4><p>This treaty established a period of relative peace between the British and Marathas for about two decades.</p> | | | | | | | Treaties |
1803 | | | | 1805 | | | | 1803-1805 | Second Anglo-Maratha War | <h3>Event Summary</h3><p>The second military conflict between the British East India Company and the Maratha Empire.</p><h4>Key Details</h4><ul><li>The war began after Peshwa Bajirao II signed the Treaty of Bassein with the English in 1802</li><li>Scindia and Bhonsle attempted to save Maratha independence but were defeated</li><li>In 1803, the Treaty of Deogaon was signed with Bhonsle and the Treaty of Surji-Anjangaon with Scindia</li><li>In 1806, the Treaty of Rajpurghat was signed with Holkar</li></ul><h4>Significance</h4><p>The British gained strategic military positions across Maratha territory, establishing the foundation for control over much of India.</p> | | | | | | | Wars |
1802 | | | | | | | | | Treaty of Bassein | <h3>Event Summary</h3><p>Peshwa Bajirao II signed the Treaty of Bassein with the English after fleeing from Jaswantrao Holkar.</p><h4>Key Details</h4><ul><li>Bajirao II had fled to Bassein after Jaswantrao Holkar defeated the combined armies of Scindia and Bajirao II</li><li>The Peshwa accepted 6,000 British troops with artillery in his territories</li><li>He ceded territories yielding ₹26 lakh income</li><li>He surrendered Surat and gave up claims on Nizam's dominions</li><li>He accepted Company's arbitration in disputes with Nizam/Gaekwad</li><li>He agreed not to employ Europeans of nations at war with England</li><li>His relations with other states became subject to English control</li></ul><h4>Significance</h4><p>This treaty effectively reduced the Peshwa to a vassal of the British and triggered the Second Anglo-Maratha War as other Maratha chiefs resisted this loss of independence.</p> | | | | | | | Treaties |
1803 | | | | | | | | | Treaty of Deogaon | <h3>Event Summary</h3><p>The Treaty of Deogaon was signed between the British East India Company and Raghuji Bhonsle II of Nagpur during the Second Anglo-Maratha War.</p><h4>Key Details</h4><ul><li>The treaty was signed in 1803 after British victories in the Second Anglo-Maratha War</li><li>It represented the surrender of Bhonsle to British power</li><li>This was one of several treaties that dismantled Maratha resistance during this period</li></ul><h4>Significance</h4><p>This treaty, along with others signed during this period, significantly expanded British control over Maratha territories and weakened the Maratha confederacy.</p> | | | | | | | Treaties |
1803 | | | | | | | | | Treaty of Surji-Anjangaon | <h3>Event Summary</h3><p>The Treaty of Surji-Anjangaon was signed between the British East India Company and Daulat Rao Scindia during the Second Anglo-Maratha War.</p><h4>Key Details</h4><ul><li>The treaty was signed in 1803 after British victories in the Second Anglo-Maratha War</li><li>It represented the surrender of Scindia to British power</li><li>This was one of several treaties that dismantled Maratha resistance during this period</li></ul><h4>Significance</h4><p>This treaty, along with others signed during this period, significantly expanded British control over Maratha territories and weakened the Maratha confederacy.</p> | | | | | | | Treaties |
1806 | | | | | | | | | Treaty of Rajpurghat | <h3>Event Summary</h3><p>The Treaty of Rajpurghat was signed between the British East India Company and Yashwantrao Holkar during the Second Anglo-Maratha War.</p><h4>Key Details</h4><ul><li>The treaty was signed in 1806, concluding the Second Anglo-Maratha War</li><li>It represented the surrender of Holkar to British power</li><li>This was the final treaty that completed British dominance over the Maratha powers in this phase</li></ul><h4>Significance</h4><p>This treaty completed the British subjugation of the major Maratha powers following the Second Anglo-Maratha War, establishing British strategic military positions across Maratha territory.</p> | | | | | | | Treaties |
1817 | | | | 1819 | | | | 1817-1819 | Third Anglo-Maratha War | <h3>Event Summary</h3><p>The final military conflict between the British East India Company and the Maratha Empire, also known as the Pindari War.</p><h4>Key Details</h4><ul><li>The war began when Bajirao II rallied Maratha chiefs against the British in 1817</li><li>The Peshwa, Appa Sahib, and Holkar attacked British positions</li><li>The Marathas were weakened by administrative inefficiency</li><li>The British prevented the Peshwa from uniting the confederacy</li><li>The Peshwa was defeated at Khirki, Bhonsle at Sitabuldi, and Holkar at Mahidpur</li><li>Various treaties were signed, including the Treaty of Poona and Treaty of Gwalior (1817) and Treaty of Mandasor (1818)</li></ul><h4>Significance</h4><p>The Peshwaship was abolished, Bajirao II became a British retainer, and the Maratha confederacy was dissolved, completing British dominance in central India.</p> | | | | | | | Wars |
1817 | | | | | | | | | Treaty of Poona | <h3>Event Summary</h3><p>The Treaty of Poona was signed between the British East India Company and Peshwa Bajirao II during the Third Anglo-Maratha War.</p><h4>Key Details</h4><ul><li>The treaty was signed in 1817 as part of the British strategy to isolate and defeat the Maratha powers</li><li>It was one of several treaties that formalized British dominance over the Marathas</li><li>Despite signing this treaty, the Peshwa later attacked British positions, leading to his ultimate defeat</li></ul><h4>Significance</h4><p>This treaty was part of the final phase of British conquest of the Maratha territories, leading to the abolition of the Peshwaship in 1818.</p> | | | | | | | Treaties |
1817 | | | | | | | | | Treaty of Gwalior | <h3>Event Summary</h3><p>The Treaty of Gwalior was signed between the British East India Company and Daulat Rao Scindia during the Third Anglo-Maratha War.</p><h4>Key Details</h4><ul><li>The treaty was signed in 1817 as part of the British strategy to isolate and defeat the Maratha powers</li><li>It was one of several treaties that formalized British dominance over the Marathas</li><li>This treaty helped the British prevent a united Maratha resistance</li></ul><h4>Significance</h4><p>This treaty was part of the final phase of British conquest of the Maratha territories, contributing to the dissolution of the Maratha confederacy in 1818.</p> | | | | | | | Treaties |
1818 | 1 | | | | | | | January 1818 | Treaty of Mandasor | <h3>Event Summary</h3><p>The Treaty of Mandasor was signed between the British East India Company and the Holkar state during the Third Anglo-Maratha War.</p><h4>Key Details</h4><ul><li>The treaty was signed in January 1818 after the Holkar forces were defeated at Mahidpur</li><li>It was one of several treaties that formalized British dominance over the Marathas</li><li>This treaty came after the Peshwa had surrendered and the confederacy was effectively dissolved</li></ul><h4>Significance</h4><p>This treaty completed the British subjugation of the major Maratha powers, finalizing the dissolution of the Maratha confederacy and establishing complete British dominance in central India.</p> | | | | | | | Treaties |
1818 | | | | | | | | | Abolition of Peshwaship | <h3>Event Summary</h3><p>The British abolished the position of Peshwa after defeating Bajirao II in the Third Anglo-Maratha War.</p><h4>Key Details</h4><ul><li>The Peshwa surrendered in 1818 after being defeated by British forces</li><li>The Maratha confederacy was dissolved</li><li>Bajirao II became a British retainer</li><li>This marked the end of the Maratha Empire as an independent political entity</li></ul><h4>Significance</h4><p>The abolition of the Peshwaship completed British dominance in central India and removed the last major native political structure that could challenge British supremacy.</p> | | | | | | | British |
1838 | | | | | | | | | Treaty of Amritsar | <h3>Event Summary</h3><p>The Treaty of Amritsar was signed between the British East India Company and Maharaja Ranjit Singh of Punjab.</p><h4>Key Details</h4><ul><li>The treaty established the Sutlej river as the boundary for Ranjit Singh's dominions</li><li>It checked Ranjit Singh's ambition to extend rule over the entire Sikh nation</li><li>It redirected his energies westward, leading to his capture of Multan (1818), Kashmir (1819), and Peshawar (1834)</li><li>The treaty was signed as the Napoleonic threat receded</li></ul><h4>Significance</h4><p>This treaty limited Sikh expansion eastward and established a clear boundary between British and Sikh territories, while allowing Ranjit Singh to expand in other directions.</p> | | | | | | | Treaties |
1838 | | | | | | | | | Tripartite Treaty | <h3>Event Summary</h3><p>The Tripartite Treaty was signed between the British East India Company, Maharaja Ranjit Singh, and Shah Shuja (the deposed Afghan ruler).</p><h4>Key Details</h4><ul><li>Political compulsions forced Ranjit Singh to sign this treaty with the English</li><li>The treaty granted British army passage through Sikh territories to attack Dost Muhammad</li><li>Shah Shuja was to be enthroned with Sikh armed help</li><li>Shah Shuja agreed to conduct foreign affairs with Sikh/British advice</li><li>Shah Shuja surrendered sovereign rights over Sindh Amirs for money</li><li>Shah Shuja recognized Sikh claims over Afghan territories on the right bank of the Indus</li></ul><h4>Significance</h4><p>This treaty facilitated British intervention in Afghanistan and demonstrated Ranjit Singh's weakened position relative to the British.</p> | | | | | | | Treaties |
1845 | 12 | 11 | | 1846 | | | | December 1845 - 1846 | First Anglo-Sikh War | <h3>Event Summary</h3><p>The first military conflict between the British East India Company and the Sikh Empire following the death of Maharaja Ranjit Singh.</p><h4>Key Details</h4><ul><li>The war began when the Sikh army crossed the River Sutlej on December 11, 1845</li><li>British forces (20,000-30,000 troops) faced Sikh forces (50,000 troops under Lal Singh)</li><li>Lal Singh and Teja Singh's treachery led to five Sikh defeats at Mudki, Ferozeshah, Buddlewal, Aliwal, and Sobraon</li><li>Lahore fell to the British in 1846</li><li>The war ended with the Treaty of Lahore</li></ul><h4>Significance</h4><p>This war significantly weakened the Sikh Empire and established British dominance in the region, leading to the Treaty of Lahore which imposed harsh terms on the Sikhs.</p> | | | | | | | Wars |
1846 | 3 | 8 | | | | | | March 8, 1846 | Treaty of Lahore | <h3>Event Summary</h3><p>The Treaty of Lahore ended the First Anglo-Sikh War between the British East India Company and the Sikh Empire.</p><h4>Key Details</h4><ul><li>The treaty was signed on March 8, 1846</li><li>The Sikhs were required to pay a war indemnity of over 1 crore rupees to the British</li><li>The Jalandhar Doab (between Beas and Sutlej) was annexed to British territories</li><li>A British resident was established at Lahore under Henry Lawrence</li><li>The Sikh army was reduced in size</li><li>Daleep Singh was recognized as ruler under Rani Jindan as regent and Lal Singh as wazir</li><li>Kashmir was sold to Gulab Singh for 75 lakh rupees when the Sikhs couldn't pay the full indemnity</li></ul><h4>Significance</h4><p>This treaty significantly reduced Sikh sovereignty and expanded British control in Punjab, setting the stage for complete annexation a few years later.</p> | | | | | | | Treaties |
1763 | | | | 1800 | | | | 1763-1800 | Sanyasi Revolt | <h3>Event Summary</h3><p>A prolonged resistance movement by sanyasis and fakirs against British economic policies in Eastern India.</p><h4>Key Details</h4><ul><li>Led by various leaders including Majnun Shah, Chirag Ali, Musa Shah, Bhawani Pathak, and Debi Chaudhurani</li><li>Triggered by the 1770 famine and harsh British economic policies</li><li>Involved raids on Company factories and treasuries</li><li>Eventually subdued by Warren Hastings</li></ul><h4>Significance</h4><p>Represented one of the early organized resistances against British economic exploitation in India.</p> | | | | | | | Revolutionary Activities |
1766 | | | | 1774 | | | | 1766-1774 | Revolt in Midnapore and Dhalbhum | <h3>Event Summary</h3><p>A rebellion led by zamindars and ryots against the British revenue system in West Bengal.</p><h4>Key Details</h4><ul><li>Led by Damodar Singh and Jagannath Dhal</li><li>Triggered by the new land revenue system introduced in 1772</li><li>Zamindars sided with ryots against British revenue officials</li><li>By 1800s, the zamindars were ultimately dispossessed</li></ul> | | | | | | | Revolutionary Activities |
1769 | | | | 1799 | | | | 1769-1799 | Revolt of Moamarias | <h3>Event Summary</h3><p>A low-caste peasant uprising that challenged the authority of Ahom kings in Assam.</p><h4>Key Details</h4><ul><li>Led by Moamaria peasants</li><li>Weakened the Ahom kingdom significantly</li><li>The King of Darrang revolted separately in 1792</li><li>Eventually led to Burmese invasion and British rule in the region</li></ul> | | | | | | | Revolutionary Activities |
